<?xml version="1.0" encoding="UTF-8" standalone="no"?>
<recipeApp xmlns:xsi="http://www.w3.org/2001/XMLSchema-instance" xsi:noNamespaceSchemaLocation="recipes.xsd">
                        
    
    
    
    
    <users>
                                                
        
        
        
        
        <user id="u1">
                                                                        
            
            
            
            
            <name>Emma</name>
                                                                        
            
            
            
            
            <surname>Rachiteanu</surname>
                                                                        
            
            
            
            
            <skillLevel>Beginner</skillLevel>
                                                                        
            
            
            
            
            <preferredCuisine>Italian</preferredCuisine>
                                                                    
        
        
        
        
        </user>
                                            
    
        
        
        
        <user id="u2">
                                                
            
            
            <name>Test</name>
                                                
            
            
            <surname>Test</surname>
                                                
            
            
            <skillLevel>Beginner</skillLevel>
                                                
            
            
            <preferredCuisine>Italian</preferredCuisine>
                                            
        
        
        </user>
                            
        
        
        <user id="u3">
                                    
            
            <name>testt</name>
                                    
            
            <surname>ete</surname>
                                    
            
            <skillLevel>Advanced</skillLevel>
                                    
            
            <preferredCuisine>Italian</preferredCuisine>
                                
        
        </user>
                    
        
        <user id="u4">
                        
            <name>Test</name>
                        
            <surname>Testettets</surname>
                        
            <skillLevel>Beginner</skillLevel>
                        
            <preferredCuisine>Italian</preferredCuisine>
                    
        </user>
            
        <user id="u5">
            <name>saed</name>
            <surname>sfds</surname>
            <skillLevel>Intermediate</skillLevel>
            <preferredCuisine>European</preferredCuisine>
        </user>
    </users>
                        
    
    
    
    
    <recipes>
                                                
        
        
        
        
        <recipe id="r1">
                                                                        
            
            
            
            
            <title>Tomato Pasta</title>
                                                                        
            
            
            
            
            <cuisines>
                                                                                                
                
                
                
                
                <cuisine>Italian</cuisine>
                                                                                                
                
                
                
                
                <cuisine>European</cuisine>
                                                                                            
            
            
            
            
            </cuisines>
                                                                        
            
            
            
            
            <difficulty>Beginner</difficulty>
                                                                    
        
        
        
        
        </recipe>
                                                
        
        
        
        
        <recipe id="r2">
                                                                        
            
            
            
            
            <title>Chicken Curry</title>
                                                                        
            
            
            
            
            <cuisines>
                                                                                                
                
                
                
                
                <cuisine>Indian</cuisine>
                                                                                                
                
                
                
                
                <cuisine>Asian</cuisine>
                                                                                            
            
            
            
            
            </cuisines>
                                                                        
            
            
            
            
            <difficulty>Intermediate</difficulty>
                                                                    
        
        
        
        
        </recipe>
                                                
        
        
        
        
        <recipe id="r3">
                                                                        
            
            
            
            
            <title>Vegetable Stir Fry</title>
                                                                        
            
            
            
            
            <cuisines>
                                                                                                
                
                
                
                
                <cuisine>Asian</cuisine>
                                                                                                
                
                
                
                
                <cuisine>Chinese</cuisine>
                                                                                            
            
            
            
            
            </cuisines>
                                                                        
            
            
            
            
            <difficulty>Beginner</difficulty>
                                                                    
        
        
        
        
        </recipe>
                                                
        
        
        
        
        <recipe id="r4">
                                                                        
            
            
            
            
            <title>Beef Tacos</title>
                                                                        
            
            
            
            
            <cuisines>
                                                                                                
                
                
                
                
                <cuisine>Mexican</cuisine>
                                                                                                
                
                
                
                
                <cuisine>American</cuisine>
                                                                                            
            
            
            
            
            </cuisines>
                                                                        
            
            
            
            
            <difficulty>Intermediate</difficulty>
                                                                    
        
        
        
        
        </recipe>
                                                
        
        
        
        
        <recipe id="r5">
                                                                        
            
            
            
            
            <title>Greek Salad</title>
                                                                        
            
            
            
            
            <cuisines>
                                                                                                
                
                
                
                
                <cuisine>Greek</cuisine>
                                                                                                
                
                
                
                
                <cuisine>European</cuisine>
                                                                                            
            
            
            
            
            </cuisines>
                                                                        
            
            
            
            
            <difficulty>Beginner</difficulty>
                                                                    
        
        
        
        
        </recipe>
                                                
        
        
        
        
        <recipe id="r6">
                                                                        
            
            
            
            
            <title>Ratatouille</title>
                                                                        
            
            
            
            
            <cuisines>